{
  "confirmation_event_ref": {
    "record_digest": "901037ab349a65af90e2c6dc0b12c291acb3425736fe2a66c103bbdff78b52a8",
    "record_family": "human_confirmation_evidence",
    "record_id": "chgrconf-5bbbb20b59874bf186f45598d0e77f8e"
  },
  "contract_version": "CHGR-001/1.0",
  "created_at": "2026-08-21T07:18:05.405475Z",
  "extensions": {},
  "limitations": [
    "repository_provenance.available is false: this construction path is a pure function of the PublicationReadinessPackage/PublicationAuthorizationEvent only, with no repository or git read (CHGR-REQ-202)."
  ],
  "options_presented": [
    "approve",
    "reject"
  ],
  "preview_content_digest": "dd38e03aa6c09dce97018633db83d51b0924911b9b21026b52dee81e4b614bf3",
  "rationale_given": "Phase 149O.20L.7O.2N.2 independently verified closure of B-149O.20L.7O.2N-1 (FIDO2 enrollment confirmation/hardware-ordering defect) at the pre-hardware governance authorization boundary. hac-dell is currently pinned at deployed commit 4efcb255ca5340224f0278f724b939d794a553ca (HMIC v1.7/38, pre-repair digest 3b076a639b9f1b0c55facfd1a721d59d92a377d4bb63dce920843264e873a68e). Current Mac repository is HEAD == origin/main == cdb77b75fc8bbca04340c7f25c405db3b07d32f7, 0 ahead/behind, clean; freshly re-derived diff against 4efcb255 shows exactly one authority-bearing file changed (scripts/hatp_hardware_credential_admin.py, the independently verified ordering repair, digest now abfbffca527d3bf6d6ba610f6f5cd2d80bf113f9aa08f4339eb40322a8c077c4); all other diffed paths are governance/report/task/test artifacts. This authorizes exactly the source-checkout transition mechanism already frozen by 149O.20L.7M and executed by 149O.20L.7N.4/7N.5 and 149O.20L.7O.2K.2/2M.2 (fetch by full candidate SHA, verify commit object type, detached checkout, chown -R root:pcae, exec-bit-derived mode normalization, full read-back parity), PLUS -- as a distinct second authorized action bundled into this single election because the declared hatp-hardware optional extra (fido2>=1.1,<2, cryptography>=42,<45) is genuinely needed by the just-deployed repaired script and was not needed by any prior redeployment in this lineage -- realization of that already-declared project extra into the canonical /opt/pcae/runtime/venv via the project's own packaging mechanism, no ad-hoc pip install, no OS-level (apt/udev/kernel/group) mutation. It authorizes nothing else.",
  "record_digest": "a865c3fe1dd9c78cd6a43d5712b7a31a6af65bbd8c155029cd57aad36cf8c136",
  "record_id": "chgrprov-3643c543e7bc46bfada47b95ebb49047",
  "record_type": "governance_record_provenance",
  "repository_provenance": {
    "available": false
  },
  "schema_id": "https://pcae.local/schemas/chgr/records/governance_record_provenance.schema.json",
  "schema_version": "1.0",
  "selected_option_id": "approve",
  "template_used_ref": {
    "template_id": "class-b-boundary-p-provisioning-authorization",
    "version": "1.0"
  }
}
