{
  "confirmation_event_ref": {
    "record_digest": "f4b50805d65f81c2c9ca34984ea053aa9d5b49eb8f4dd4e4e90c1c44216e210f",
    "record_family": "human_confirmation_evidence",
    "record_id": "chgrconf-af23221732aa437db2e8b6364274e609"
  },
  "contract_version": "CHGR-001/1.0",
  "created_at": "2026-07-23T00:00:00Z",
  "extensions": {},
  "limitations": [
    "This is a synthetic fixture; repository provenance intentionally undisclosed."
  ],
  "options_presented": [
    "proceed",
    "decline"
  ],
  "preview_content_digest": "edc77daddb070bdbb84f7ac5b0d1d4542bf3c5550558c23facdbd61b6a4053c3",
  "rationale_given": "Synthetic fixture rationale text.",
  "record_digest": "8e2a2f3b5beaa1874dab4af993fa722206ffae9409ede1035eebb8b73237215c",
  "record_id": "chgrprov-366f66dd59fe45f184842331dbf79c80",
  "record_type": "governance_record_provenance",
  "repository_provenance": {
    "available": false
  },
  "schema_id": "https://pcae.local/schemas/chgr/records/governance_record_provenance.schema.json",
  "schema_version": "1.0",
  "selected_option_id": "proceed",
  "template_used_ref": {
    "template_id": "synthetic-example-decision",
    "version": "1.0"
  }
}
