{
  "confirmation_event_ref": {
    "record_digest": "15a9951ddea68975f7ca160e7605c17ee0c570cabe95db6b63a17739bcde7e4e",
    "record_family": "human_confirmation_evidence",
    "record_id": "chgrconf-698eefcec95841ef8350e94fa7a59ea8"
  },
  "contract_version": "CHGR-001/1.0",
  "created_at": "2026-08-18T10:30:17.422428Z",
  "extensions": {},
  "limitations": [
    "repository_provenance.available is false: this construction path is a pure function of the PublicationReadinessPackage/PublicationAuthorizationEvent only, with no repository or git read (CHGR-REQ-202)."
  ],
  "options_presented": [
    "approve",
    "decline",
    "amend"
  ],
  "preview_content_digest": "616ffc29fc0a6f20110a9decbb0d72a9587426ec91ba1eb9db38eba30530b2bd",
  "rationale_given": "P-A' (chmod 1770) was independently verified in 149O.20L.7O.2A.1 as the minimum-safe current-architecture remediation for the RepositoryIdentity write-path provisioning gap on hac-dell. Intent: allow the pcae OS principal to create legitimate runtime-local .pcae artifacts via mkstemp+os.replace/exclusive-create idioms; preserve existing root ownership of all 17 tracked governed .pcae entries; rely on Linux sticky-directory semantics (S_ISVTX, kernel check_sticky()/may_delete() in fs/namei.c) to prevent the non-owner pcae group member from unlinking, renaming, or rename-replacing existing root-owned files; keep the Protected Root /etc/pcae/hatp/trust-store entirely unaffected (no shared filesystem ancestor). 1770 does not make .pcae generally trusted or authority-bearing; the only authority-relevant consumer of anything under .pcae/ is HBDC-REQ-042 (_check_deployment_identity), which cross-checks against the Protected Root, not against .pcae/'s own mode.\n\nRequired disclosed correction (carried forward from 7O.2A.1 SS5/SS11/SS32, independently re-confirmed this phase): P-A' correctly fixes the write-path provisioning problem for 38 of the 39 declared write-required .pcae artifacts (the .gitignore-declared set). It does NOT fix architecture-history.json, whose producer (write_architecture_history_snapshot, architecture.py) uses a direct truncating open(\"w\") on a pre-existing, root-owned 0640 file rather than the mkstemp+os.replace atomic-create idiom repository_identity.py uses -- a directory-mode-only change cannot grant write access denied by the file's own mode bits. That artifact's fix is a separate, not-yet-designed producer change, out of this proposition's scope and deferred. This election does not claim P-A' covers the complete write-required inventory.\n\nSticky-bit evidence qualification (carried forward, tier-tagged per 7O.2A.1 SS1/SS8): the sticky-bit protection relied upon is REFERENCE-VERIFIED FROM PRIMARY LINUX/POSIX SOURCES (S_ISVTX, POSIX/SUSv4-mandated, identical mechanism to /tmp's own long-standing 1777 behavior on every mainstream Linux distribution) -- it was not empirically tested by creating synthetic root-owned files on hac-dell during 7O.2A.1, because that phase prohibited Dell mutation, and this phase (7O.2A.2) is election/publication-only and performs zero Dell mutation as well. This is an evidence qualification, not a blocking finding.\n\nFresh HBDC re-check performed this phase, live, read-only, via sudo -n -u pcae under the canonical corrected Action-9 environment (env -i reset, PATH=/opt/pcae/runtime/venv/bin:/usr/bin:/bin:/usr/sbin:/sbin, HOME=/home/pcae, PYTHONNOUSERSITE=1, cwd=/opt/pcae/runtime/src): status NON_COMPLIANT, sole residual HBDC-REQ-042 (no_repository_identity_present); HBDC-REQ-036 independently confirmed True (launcher_agent_unwritable) under the same canonical invocation. Matches the expected baseline exactly -- proceeded to election, no STOP.",
  "record_digest": "59174f910dcda1c0516c6cc665a52bd47ae502c8e2d6bd171c29d712ea6d44f8",
  "record_id": "chgrprov-5a681f551c3646af81d7ecdb1a3ccff1",
  "record_type": "governance_record_provenance",
  "repository_provenance": {
    "available": false
  },
  "schema_id": "https://pcae.local/schemas/chgr/records/governance_record_provenance.schema.json",
  "schema_version": "1.0",
  "selected_option_id": "approve",
  "template_used_ref": {
    "template_id": "class-b-boundary-p-provisioning-authorization",
    "version": "1.0"
  }
}
